{
  "$schema": "../../../tools/schemas/fable2-gpu-subsystem-map-v1.schema.json",
  "schema_version": "1.0.0",
  "corpus": "Fable II Native Renderer G1.5A",
  "pinned_rexglue_commit": "956c6a8b5da4c54b9899a2593e9c67c26de30194",
  "confidence_vocabulary": ["CONFIRMED", "PROBABLE", "UNKNOWN", "NOT APPLICABLE"],
  "subsystems": [
    {
      "id": "plugin-runtime-boundary",
      "title": "Plugin loading, ABI and runtime ownership",
      "coverage": "FULL",
      "inputs": ["--gpu_plugin=xenos", "GpuCreateInfo ABI 1", "ReXApp WindowedAppContext", "Runtime FunctionDispatcher and KernelState"],
      "persistent_state": ["process-lifetime DynamicLibrary handle", "Runtime-owned IGraphicsSystem", "GraphicsSystem provider, presenter, command processor and vblank worker"],
      "outputs": ["D3D12GraphicsSystem instance in the current build", "MMIO mapping", "Vd service delegation"],
      "xenos_vs_rexglue": "The IGraphicsSystem ABI, DLL naming and lifetime policy are ReXGlue-specific; the resulting GPU object models Xenos services.",
      "backend_boundary": "rex_gpu_create chooses D3D12 before Vulkan for backend=any. The pinned DLL contains D3D12 and excludes Vulkan.",
      "symbols": [
        { "repository": "rexglue", "path": "src/ui/rex_app.cpp", "type": "function", "symbol": "ReXApp::SetupPresentation", "confidence": "CONFIRMED", "role": "loads the configured plugin and establishes presentation first" },
        { "repository": "rexglue", "path": "src/system/gpu_plugin_loader.cpp", "type": "function", "symbol": "LoadGpuPlugin", "confidence": "CONFIRMED", "role": "loads rexgpu-xenos.dll, validates ABI and retains the library" },
        { "repository": "rexglue", "path": "src/graphics/plugin_main.cpp", "type": "export", "symbol": "rex_gpu_create", "confidence": "CONFIRMED", "role": "constructs the compiled backend graphics system" },
        { "repository": "rexglue", "path": "src/system/runtime.cpp", "type": "function", "symbol": "Runtime::Shutdown", "confidence": "CONFIRMED", "role": "shuts down and destroys the graphics system while the DLL remains loaded" }
      ],
      "fable_connection": { "status": "CONFIRMED", "evidence": "Fable CMake stages xenos and existing fable2-run-048.log records GPU plugin 'xenos' loaded and a D3D12 NVIDIA adapter.", "observation_point": "rex::system::LoadGpuPlugin" },
      "unresolved": ["No runtime trace in G1.5A proves the exact ABI calls for any individual Fable frame; initialization is confirmed independently."]
    },
    {
      "id": "command-processor",
      "title": "Ring buffer, PM4 decoding, indirect buffers, waits and interrupts",
      "coverage": "FULL",
      "inputs": ["guest ring base and size", "write pointer MMIO", "Type 0/1/2/3 packets", "indirect buffer addresses"],
      "persistent_state": ["ring pointers and read-pointer writeback", "worker thread and events", "ME bin masks", "interrupt callback", "swap counter"],
      "outputs": ["register writes", "draw/copy/swap virtual calls", "guest memory writes", "guest interrupt dispatch"],
      "xenos_vs_rexglue": "Packet encodings and register effects are Xenos-facing; worker scheduling, logging, sleep/yield policy and unsupported-opcode handling are ReXGlue choices.",
      "backend_boundary": "The base CommandProcessor decodes packets. D3D12CommandProcessor implements draw, copy, swap and host query operations.",
      "symbols": [
        { "repository": "rexglue", "path": "src/graphics/command_processor.cpp", "type": "function", "symbol": "CommandProcessor::WorkerThreadMain", "confidence": "CONFIRMED", "role": "consumes the primary ring and writes the read pointer" },
        { "repository": "rexglue", "path": "src/graphics/command_processor.cpp", "type": "function", "symbol": "CommandProcessor::ExecutePacketType3", "confidence": "CONFIRMED", "role": "dispatches PM4 Type 3 opcodes" },
        { "repository": "rexglue", "path": "src/graphics/command_processor.cpp", "type": "function", "symbol": "CommandProcessor::ExecutePacketType3_INDIRECT_BUFFER", "confidence": "CONFIRMED", "role": "translates and executes indirect command buffers" },
        { "repository": "rexglue", "path": "src/graphics/command_processor.cpp", "type": "function", "symbol": "CommandProcessor::ExecutePacketType3_WAIT_REG_MEM", "confidence": "CONFIRMED", "role": "performs register/memory waits and coherency handling" }
      ],
      "fable_connection": { "status": "CONFIRMED", "evidence": "Accepted G1 proves sub_82BA34D8 reaches VdSwap, which emits PM4_XE_SWAP; it does not prove other packet classes for Fable.", "observation_point": "CommandProcessor::ExecutePacketType3" },
      "unresolved": ["UNKNOWN FOR FABLE II: packet/opcode frequency and indirect-buffer topology. Evidence required: packet trace for the pinned TU1 image. Suggested later observation point: CommandProcessor::ExecutePacketType3."]
    },
    {
      "id": "register-state",
      "title": "GPU register file, writes, coherency and dirty state",
      "coverage": "FULL",
      "inputs": ["MMIO writes", "Type 0/1 packets", "SET_CONSTANT and shader-load packets"],
      "persistent_state": ["0x5003-dword RegisterFile", "extended out-of-range register map", "D3D12 pipeline/binding invalidation flags"],
      "outputs": ["typed register views", "fetch constants", "draw/copy state", "backend dirty-state notifications"],
      "xenos_vs_rexglue": "Register indices and bit layouts are Xenos data; the generated table, extended map and per-backend dirty-state policy are implementation structures.",
      "backend_boundary": "Base writes preserve register values. D3D12CommandProcessor::WriteRegister adds resource and pipeline invalidation decisions.",
      "symbols": [
        { "repository": "rexglue", "path": "include/rex/graphics/register_file.h", "type": "class", "symbol": "RegisterFile", "confidence": "CONFIRMED", "role": "owns indexed and extended register values" },
        { "repository": "rexglue", "path": "src/graphics/command_processor.cpp", "type": "function", "symbol": "CommandProcessor::WriteRegister", "confidence": "CONFIRMED", "role": "applies generic register side effects" },
        { "repository": "rexglue", "path": "src/graphics/d3d12/command_processor.cpp", "type": "function", "symbol": "D3D12CommandProcessor::WriteRegister", "confidence": "CONFIRMED", "role": "invalidates D3D12 state and resource residency" },
        { "repository": "rexglue", "path": "src/graphics/command_processor.cpp", "type": "function", "symbol": "CommandProcessor::MakeCoherent", "confidence": "CONFIRMED", "role": "handles COHER_STATUS_HOST waits with an incomplete cache notification path" }
      ],
      "fable_connection": { "status": "UNKNOWN FOR FABLE II", "evidence_required": "register write trace tied to the pinned TU1 executable", "suggested_later_observation_point": "D3D12CommandProcessor::WriteRegister" },
      "unresolved": ["The exact Fable register write sequence and dirty-state churn cannot be established statically.", "MakeCoherent clears the status but retains a TODO for resource-cache notification."]
    },
    {
      "id": "draw-initiation",
      "title": "Draw triggers, extents, topology, indices, predication and queries",
      "coverage": "PARTIAL",
      "inputs": ["DRAW_INDX or DRAW_INDX_2 packet", "primitive type", "index count/source/endian", "current register state"],
      "persistent_state": ["bin predication state", "query state", "primitive-conversion cache", "draw extent estimates"],
      "outputs": ["backend IssueDraw", "converted topology/index buffer", "optional query writes"],
      "xenos_vs_rexglue": "Primitive types, reset indices and query packets are Xenos semantics; conversion algorithms, fake-query fallback and dropped unsupported immediate-index draws are ReXGlue behavior.",
      "backend_boundary": "Base packet parsing builds IndexBufferInfo. Common PrimitiveProcessor converts unsupported topology; D3D12 binds and issues DrawInstanced/DrawIndexedInstanced.",
      "symbols": [
        { "repository": "rexglue", "path": "src/graphics/command_processor.cpp", "type": "function", "symbol": "CommandProcessor::ExecutePacketType3Draw", "confidence": "CONFIRMED", "role": "parses draw packets and initiates the backend draw" },
        { "repository": "rexglue", "path": "src/graphics/primitive_processor.cpp", "type": "function", "symbol": "PrimitiveProcessor::Process", "confidence": "CONFIRMED", "role": "normalizes topology, reset and index data" },
        { "repository": "rexglue", "path": "src/graphics/d3d12/command_processor.cpp", "type": "function", "symbol": "D3D12CommandProcessor::IssueDraw", "confidence": "CONFIRMED", "role": "configures resources and emits the host draw" },
        { "repository": "rexglue", "path": "src/graphics/d3d12/command_processor.cpp", "type": "function", "symbol": "D3D12CommandProcessor::BeginGuestOcclusionQuery", "confidence": "CONFIRMED", "role": "optional host occlusion-query path" }
      ],
      "fable_connection": { "status": "UNKNOWN FOR FABLE II", "evidence_required": "draw packet plus register snapshot and returned IssueDraw result", "suggested_later_observation_point": "D3D12CommandProcessor::IssueDraw" },
      "unresolved": ["Immediate-index draw support is absent.", "Predication and query parity are incomplete and Fable use is unknown.", "Static analysis cannot identify Fable's primitive mix or skipped draws."]
    },
    {
      "id": "vertex-fetch",
      "title": "Vertex fetch, formats, endian and index conversion",
      "coverage": "PARTIAL",
      "inputs": ["vertex fetch constants", "shader vertex-fetch analysis", "guest physical ranges", "index buffer metadata"],
      "persistent_state": ["per-fetch residency", "shared-memory requests", "primitive conversion cache and watches"],
      "outputs": ["host vertex SRV bindings", "host index buffer", "host topology"],